{"algorithm":"reproassert-v02-selection-freeze-v1","case_count":20,"cohort_plan_sha256":"20d8e5cac69f51419caf134b4a1adcd2c819e15f078e9e9dd1c11ce717a1c31c","dataset_parser_boundary_attestation_sha256":"4fc2b282fad53792319cf3baa19c3a24b28d2f12c7b3e6f40cbe931012030a87","dataset_parser_image_digest":"sha256:0bf07669fd085b608e6859b90a486b3ede52d8cc409309410181ab32fbe1118f","dataset_parser_private_receipt_sha256":"67f337d762536333e06821e91cc1a85dc37ae2b86c14af26057cd090685f96ae","issue_text_source":"dataset_snapshot_at_pinned_commit","issue_text_source_commit":"7f1793642f5ab809c0bce2e343b902247954170e","oracle_leak_audit_passed_cases":20,"privacy":{"developer_test_bytes_published":false,"generator_issue_text_published":false,"hints_text_published":false,"production_patch_bytes_published":false},"production_boundary_verified":true,"results":{"benchmark_cases_executed":0,"l1_valid_reproductions":0,"l2_semantic_valid_reproductions":0,"maintainer_validations":0},"selection_freeze_sha256":"ca12381314458264bc5830250af3fb1b4bf0bef6112b12ff070bd015d3da2464","status":"selection_frozen_not_campaign_preregistered","upstream_evidence_sha256":"ea68fc3aa8754e13929e4532fd9ad0cc03ff8614dad41165417ca07bbb00a70c","upstream_object_witness_sha256":"4b9194fff1564eb493aff65fec967833a54116132f5a5b49a2c6500000380595"}
